{"artifact_type":"metadrive_native_probe_evidence_v0.1","bindings":{"native_observer":{"bytes":10931,"path":"/home/shijie20/CodeSpace/ChatScene/bus_benchmark/native_observer.py","sha256":"048ce204cc73feaa387cef226d109ee3c5bb8005ef6cd3764a215b7a85510309"},"platform_runtime_config":{"bytes":1742,"path":"/home/shijie20/CodeSpace/ChatScene/benchmark_configs/platforms/metadrive_runtime_draft.json","sha256":"acea8ad6bf242bc22084779d0fa3480aeb87d8a03f04817ce609ac820f231408"},"probe_runner":{"bytes":16430,"path":"/home/shijie20/CodeSpace/ChatScene/scripts/metadrive_track_probe.py","sha256":"b974e8e8329c4f5a74dc1c2e4b55540542681cc48bf7b4ec28ca5005e02d252a"},"runtime_environment_manifest":{"bytes":19567,"path":"/home/shijie20/CodeSpace/ChatScene/benchmark_configs/platforms/metadrive_runtime_environment_draft.json","sha256":"e68ad96196bd1fb4acae8511ff5e74709d1083d34744035b98a06730cfc1a7b7"},"token_registry":{"bytes":5689,"path":"/home/shijie20/CodeSpace/ChatScene/benchmark_configs/methods/metadrive_pg_token_registry_draft.json","sha256":"0b0dea11bf337284338659b58790a4b89dbfb8849f6f83562509a3e7301fef24"}},"claim_scope":{"human_gold":false,"iec_execution_proven":false,"long_sequence_constructibility_proven":false,"method_run_evidence":false,"real_map_used":false,"thirty_second_ne_proven":false,"token_coverage":"single_token_materialization","validation_level":"native_pgmap_reset_step"},"evidence_mode":"development","platform":"metadrive","probe_id":"metadrive_sequence_block_track_probe_v0.1","reset_step":{"actual_block_ids":["I","S"],"block_sequence":"S","expected_block_ids":["I","S"],"physical_height_m":2.8,"physical_length_m":5.74,"physical_width_m":2.3,"reset_succeeded":true,"status":"passed","step_action":[0.0,0.0],"step_succeeded":true,"top_down_length_m":5.33,"top_down_width_m":2.1,"vehicle_class":"XLVehicle","vehicle_model":"xl"},"runtime":{"environment_decision_status":"draft","interpreter":{"bytes":16439752,"path":"/home/shijie20/micromamba/envs/scenarionet/bin/python3.9","sha256":"b40c868cc8e8e6d13db940136a7dd681f8fcfdf9fa2dbeeeca52821828e65fa7"},"locked_dependencies_sha256":"1090684a9769df2d1641f28cc12f3c8644b243ebd41e2980d6131263d07da68c","locked_dependency_count":285,"metadrive_module":{"bytes":419,"path":"/home/shijie20/CodeSpace/mdsn/metadrive/metadrive/__init__.py","sha256":"ca707531ce36f05447e5c89f4507398bfcb11c907b8f613f5849212ba3b50524"},"metadrive_version":"0.4.3","python_runtime_version":"3.9.23","source_describe":"MetaDrive-0.4.3-32-g85e5dadc","source_tree":{"policy":"git_tracked_worktree_bytes_v0.1","repository_path":"/home/shijie20/CodeSpace/mdsn/metadrive","revision":"85e5dadc6c7436d324348f6e3d8f8e680c06b4db","tracked_bytes":72607504,"tracked_file_count":1371,"tracked_subpath":"metadrive","tracked_tree_sha256":"2f3feca22ca46c33221c0fa943b76b232d1e3814ae3250b83716dca0fda942c6"}},"runtime_fixture":{"artifact":{"actors":[],"artifact_type":"metadrive_pg_block_scene_v0.1","ego":{"actor_id":"ego","actor_type":"vehicle","length_m":5.33,"reference_trajectory":[{"heading_rad":0.0,"position_m":[0.0,0.0],"speed_m_s":5.0,"step":0,"valid":true},{"heading_rad":0.0,"position_m":[0.5,0.0],"speed_m_s":5.0,"step":1,"valid":true}],"vehicle_model":"xl","width_m":2.1},"horizon_steps":2,"map":{"block_sequence":"S","exit_length_m":50.0,"generation_type":"block_sequence","lane_num":2,"lane_width_m":3.5,"map_seed":0,"token_registry_id":"metadrive-pg-token-registry-v0.1","token_registry_sha256":"0b0dea11bf337284338659b58790a4b89dbfb8849f6f83562509a3e7301fef24"},"schema_version":"0.1","time_step_s":0.1},"artifact_bytes":683,"artifact_sha256":"f96811fa5632e3bcabdbc9a04354a7083044575b26c7517227ca15728435c0cb","fixture_status":"benchmark_constructed_development_probe"},"schema_version":"0.1","status":"passed","token_registry_check":{"expected_native_failures":[{"actual_block_ids":null,"case_id":"F@lane2","expected_block_ids":null,"expected_outcome":"native_failure","failure_contract":"known_fork_constructor_failure","lane_num":2,"map_feature_count":0,"observed_outcome":"native_failure","token":"F"},{"actual_block_ids":null,"case_id":"f@lane2","expected_block_ids":null,"expected_outcome":"native_failure","failure_contract":"known_fork_constructor_failure","lane_num":2,"map_feature_count":0,"observed_outcome":"native_failure","token":"f"},{"actual_block_ids":null,"case_id":"P@lane2","expected_block_ids":null,"expected_outcome":"native_failure","failure_contract":"parking_requires_one_lane","lane_num":2,"map_feature_count":0,"observed_outcome":"native_failure","token":"P"}],"lane_num_constraints":{"$":[1,2,3,4,5],"B":[1,2,3,4,5],"C":[1,2,3,4,5],"O":[1,2,3,4,5],"P":[1],"R":[1,2,3,4,5],"S":[1,2,3,4,5],"T":[1,2,3,4,5],"U":[1,2,3,4,5],"X":[1,2,3,4,5],"Y":[1,2,3,4,5],"r":[1,2,3,4,5],"y":[1,2,3,4,5]},"positive_cases":[{"actual_block_ids":["I","$"],"case_id":"$","expected_block_ids":["I","$"],"expected_outcome":"materialized","failure_contract":null,"lane_num":2,"map_feature_count":30,"observed_outcome":"materialized","token":"$"},{"actual_block_ids":["I","B"],"case_id":"B","expected_block_ids":["I","B"],"expected_outcome":"materialized","failure_contract":null,"lane_num":2,"map_feature_count":26,"observed_outcome":"materialized","token":"B"},{"actual_block_ids":["I","C"],"case_id":"C","expected_block_ids":["I","C"],"expected_outcome":"materialized","failure_contract":null,"lane_num":2,"map_feature_count":40,"observed_outcome":"materialized","token":"C"},{"actual_block_ids":["I","O"],"case_id":"O","expected_block_ids":["I","O"],"expected_outcome":"materialized","failure_contract":null,"lane_num":2,"map_feature_count":114,"observed_outcome":"materialized","token":"O"},{"actual_block_ids":["I","P"],"case_id":"P","expected_block_ids":["I","P"],"expected_outcome":"materialized","failure_contract":null,"lane_num":1,"map_feature_count":256,"observed_outcome":"materialized","token":"P"},{"actual_block_ids":["I","R"],"case_id":"R","expected_block_ids":["I","R"],"expected_outcome":"materialized","failure_contract":null,"lane_num":2,"map_feature_count":56,"observed_outcome":"materialized","token":"R"},{"actual_block_ids":["I","S"],"case_id":"S","expected_block_ids":["I","S"],"expected_outcome":"materialized","failure_contract":null,"lane_num":2,"map_feature_count":30,"observed_outcome":"materialized","token":"S"},{"actual_block_ids":["I","T"],"case_id":"T","expected_block_ids":["I","T"],"expected_outcome":"materialized","failure_contract":null,"lane_num":2,"map_feature_count":55,"observed_outcome":"materialized","token":"T"},{"actual_block_ids":["I","U"],"case_id":"U","expected_block_ids":["I","U"],"expected_outcome":"materialized","failure_contract":null,"lane_num":2,"map_feature_count":86,"observed_outcome":"materialized","token":"U"},{"actual_block_ids":["I","X"],"case_id":"X","expected_block_ids":["I","X"],"expected_outcome":"materialized","failure_contract":null,"lane_num":2,"map_feature_count":78,"observed_outcome":"materialized","token":"X"},{"actual_block_ids":["I","Y"],"case_id":"Y","expected_block_ids":["I","Y"],"expected_outcome":"materialized","failure_contract":null,"lane_num":2,"map_feature_count":56,"observed_outcome":"materialized","token":"Y"},{"actual_block_ids":["I","r"],"case_id":"r","expected_block_ids":["I","r"],"expected_outcome":"materialized","failure_contract":null,"lane_num":2,"map_feature_count":66,"observed_outcome":"materialized","token":"r"},{"actual_block_ids":["I","y"],"case_id":"y","expected_block_ids":["I","y"],"expected_outcome":"materialized","failure_contract":null,"lane_num":2,"map_feature_count":38,"observed_outcome":"materialized","token":"y"}],"registry_decision_status":"draft","registry_id":"metadrive-pg-token-registry-v0.1","token_mapping":{"$":"TollGate","B":"Bidirection","C":"Curve","O":"Roundabout","P":"ParkingLot","R":"OutRampOnStraight","S":"Straight","T":"StdTInterSection","U":"StdInterSectionWithUTurn","X":"StdInterSection","Y":"Split","r":"InRampOnStraight","y":"Merge"}}}
